{
  "arguments": [
    "--config-file",
    "empty.lcovrc",
    "--help"
  ],
  "case_id": "m0-policy-shared-perl2lcov-config-file-exact",
  "command": "perl2lcov",
  "comparison_contract": [
    {
      "dimension": "exit",
      "normalizer": "exact-v1"
    },
    {
      "dimension": "stdout",
      "normalizer": "exact-v1"
    },
    {
      "dimension": "stderr",
      "normalizer": "exact-v1"
    },
    {
      "dimension": "filesystem",
      "normalizer": "exact-v1"
    }
  ],
  "effective_environment_variables": {
    "HOME": "/work",
    "LANG": "C",
    "LC_ALL": "C",
    "PATH": "/usr/local/sbin:/usr/local/bin:/usr/sbin:/usr/bin:/sbin:/bin",
    "TZ": "UTC"
  },
  "environment": {
    "architecture": "x86_64",
    "compiler": "GCC 12.2.0",
    "cpu": null,
    "image": "sha256:b02cc645313ff5b0a09adc6d6ddeb5e670e48d64ac376b6b29b34b9d56eb80b7",
    "operating_system": "Debian 12"
  },
  "evidence_scope": "compatibility",
  "execution": {
    "network": "none",
    "read_only": true,
    "user": "1000:1000",
    "working_directory": "/work"
  },
  "execution_manifest_sha256": "sha256:a15e953f5dfa176ac0d2f2b0c8668f190951f64e58a69bd9e63365e8eb3ea981",
  "fixture": "compat/fixtures/m0-cli-contract/config",
  "oracle_identity": {
    "container_image_sha256": "sha256:b02cc645313ff5b0a09adc6d6ddeb5e670e48d64ac376b6b29b34b9d56eb80b7",
    "executable_sha256": "sha256:f8448ef0bb4befed9aadca178d4cf52a719dae5ab5ab241be1a5167e230a666b",
    "kind": "docker_image"
  },
  "product_compatibility_evidence": false,
  "reference_run": {
    "cleanup": {
      "container_absent": true,
      "direct_child_reaped": true,
      "process_group_empty": null
    },
    "exit_code": 0,
    "file_tree_artifact": "reference/file-tree.json",
    "file_tree_bytes": 311,
    "file_tree_sha256": "bb6c55c14d60aad5986db518b7b5f83ef19a6ab7241a22f8ab9edef6f4f7ef7d",
    "metrics": {
      "output_bytes": 67,
      "output_files": 1,
      "peak_rss_bytes": null,
      "system_cpu_seconds": null,
      "user_cpu_seconds": null,
      "wall_seconds": 1.8330101060000001
    },
    "signal": null,
    "stderr_artifact": "reference/stderr.bin",
    "stderr_bytes": 0,
    "stderr_sha256": "e3b0c44298fc1c149afbf4c8996fb92427ae41e4649b934ca495991b7852b855",
    "stdout_artifact": "reference/stdout.bin",
    "stdout_bytes": 2467,
    "stdout_sha256": "3f07d4308bc338ad05cb4844b70b53ca92b395be0f2accde172bb9eb55d052d5",
    "timeout": {
      "applied_seconds": 20,
      "escalation_signal_sent": null,
      "expired": false,
      "termination_signal_sent": null
    }
  },
  "schema_version": 1,
  "status": "observed",
  "suite_id": "m0-cli-contract-policy",
  "surface": "cli",
  "upstream_commit": "74c8eabbb36d7cf2454d3f0ea37bf1337641cbc5"
}
